ORCID,Author,Institution,Title,PubDate,Abstract,DOI,IDlist,flag,found_words
0000-0002-0235-0931,Sebastian Bauer,Kiel University,Post-Newtonian dynamics at order 1.5 in the Vlasov-Maxwell system,2006,"  We study the dynamics of many charges interacting with the Maxwell field. The particles are modeled by means of non-negative distribution functions $f^+$ and $f^-$ representing two species of charged matter with positive and negative charge, respectively. If their initial velocities are small compared to the speed of light, $c$, then in lowest order, the Newtonian or classical limit, their motion is governed by the Vlasov-Poisson system. We investigate higher order corrections with an explicit control on the error terms. The Darwin order correction, order $|v/c|^2$, has been proved previously. In this contribution we obtain the dissipative corrections due to radiation damping, which are of order $|v/c|^3$ relative to the Newtonian limit. If all particles have the same charge-to-mass ratio, the dissipation would vanish at that order. ",Kein DOI-Link verfügbar,math-ph/0602031v1,No,
0000-0002-0235-0931,Sebastian Bauer,Kiel University,Post-Newtonian approximation of the Vlasov-Nordström system,2004,"  We study the Nordstr\""om-Vlasov system which describes the dynamics of a self-gravitating ensemble of collisionless particles in the framework of the Nordstr\""om scalar theory of gravitation. If the speed of light $c$ is considered as a parameter, it is known that in the Newtonian limit $c\to\infty$ the Vlasov-Poisson system is obtained. In this paper we determine a higher approximation and establish a pointwise error estimate of order $O(c^{-4})$. Such an approximation is usually called a 1.5 post-Newtonian approximation. ",Kein DOI-Link verfügbar,math-ph/0410048v1,No,
0000-0002-0235-0931,Sebastian Bauer,Kiel University,On Korn's First Inequality for Mixed Tangential and Normal Boundary   Conditions on Bounded Lipschitz-Domains in $\mathbb{R}^N$,2015,  We prove that for bounded Lipschitz domains in $\mathbb{R}^N$ Korn's first inequality holds for vector fields satisfying homogeneous mixed normal and tangential boundary conditions. ,Kein DOI-Link verfügbar,1512.08483v2,No,
0000-0002-0235-0931,Sebastian Bauer,Kiel University,The Darwin Approximation of the Relativistic Vlasov-Maxwell System,2004,"  We study the relativistic Vlasov-Maxwell system which describes large systems of particles interacting by means of their collectively generated forces. If the speed of light $c$ is considered as a parameter then it is known that in the Newtonian limit $c\to\infty$ the Vlasov-Poisson system is obtained. In this paper we determine the next order approximate system, which in the case of individual particles usually is called the Darwin approximation. ",https://doi.org/10.1007/s00023-005-0207-y,math-ph/0401012v1,No,
0000-0002-0235-0931,Sebastian Bauer,Kiel University,On Korn's First Inequality for Tangential or Normal Boundary Conditions   with Explicit Constants,2015,  We will prove that for piecewise smooth and concave domains Korn's first inequality holds for vector fields satisfying homogeneous normal or tangential boundary conditions with explicit Korn constant square root of 2. ,https://doi.org/10.1002/mma.3954,1503.07419v5,No,
0000-0002-0235-0931,Sebastian Bauer,Kiel University,Dev-Div- and DevSym-DevCurl-inequalities for incompatible square tensor   fields with mixed boundary conditions,2013,  For an n-dimensional bounded domain we derive some inequalities bounding the norm of a square tensor field. Concerning the Div-Dev-inequality the bound is given by the trace-free part and the divergence and the tensor. In the case of the DevSym-Curl-inequality the bound is given by the trace-free and symmetric part and the curl of the tensor. For n=3 the bound is given by the trace-free symmetric part of the tensor and the trace-free part of the curl of the tensor. Some prototype applications are presented in which the new inequalities may be used to derive the coercivity of the models. ,Kein DOI-Link verfügbar,1307.1434v1,No,
0000-0002-0235-0931,Sebastian Bauer,Kiel University,Proceedings Fourth Workshop on Foundations of Interface Technologies,2012,"  This volume contains the proceedings of the 4th workshop on Foundations of Interface Technologies (FIT 2012) which was collocated with ETAPS 2012 in Tallinn, Estonia, and took place on March 25, 2012. The aim of this workshop is to bring together researchers who are interested in the formal underpinnings of interface technologies. ",https://doi.org/10.4204/EPTCS.87,1207.3485v1,No,
0000-0002-0235-0931,Sebastian Bauer,Kiel University,The Maxwell Compactness Property in Bounded Weak Lipschitz Domains with   Mixed Boundary Conditions,2015,"  For a bounded weak Lipschitz domain we show the so called `Maxwell compactness property', that is, the space of square integrable vector fields having square integrable weak rotation and divergence and satisfying mixed tangential and normal boundary conditions is compactly embedded into the space of square integrable vector fields. We will also prove some canonical applications, such as Maxwell estimates, Helmholtz decompositions and a static solution theory. Furthermore, a Fredholm alternative for the underlying time-harmonic Maxwell problem and all corresponding and related results for exterior domains formulated in weighted Sobolev spaces are straight forward. ",Kein DOI-Link verfügbar,1511.06697v4,No,
0000-0002-0235-0931,Sebastian Bauer,Kiel University,Weck's Selection Theorem: The Maxwell Compactness Property for Bounded   Weak Lipschitz Domains with Mixed Boundary Conditions in Arbitrary Dimensions,2018,"  It is proved that the space of differential forms with weak exterior and co-derivative, is compactly embedded into the space of square integrable differential forms. Mixed boundary conditions on weak Lipschitz domains are considered. Furthermore, canonical applications such as Maxwell estimates, Helmholtz decompositions and a static solution theory are proved. As a side product and crucial tool for our proofs we show the existence of regular potentials and regular decompositions as well. ",Kein DOI-Link verfügbar,1809.01192v4,Yes,potent(1)
0000-0002-0235-0931,Sebastian Bauer,Kiel University,Phasor field waves: A statistical treatment for the case of a partially   coherent optical carrier,2020,"  This paper presents a statistical treatment of phasor fields (P-fields) - a wave-like quantity denoting the slow temporal variations in time-averaged irradiance (which was recently introduced to model and describe non-line-of-sight (NLoS) imaging as well as imaging through diffuse or scattering apertures) - and quantifies the magnitude of a spurious signal which emerges due to a partial spatial coherence of the underlying optical carrier. This spurious signal is not described by the Huygens-like P-field imaging integral which assumes optical incoherence as a necessary condition to describe P-field imaging completely (as was shown by Reza etal. recently). In this paper, we estimate the relationship between the expected magnitude of this spurious signal and the degree of partial roughness within the P-field imaging system. The treatment allows us to determine the accuracy of the estimate provided by the P-field integral for varying degrees of partial coherence and allows to define a P-field signal-to-noise ratio as a figure-of-merit for the case of a partially coherent optical carrier. The study of partial coherence also enables to better relate aperture roughness to P-field noise. ",Kein DOI-Link verfügbar,2006.02600v2,No,
0000-0002-0235-0931,Sebastian Bauer,Kiel University,Multipole radiation in a collisonless gas coupled to electromagnetism or   scalar gravitation,2005,"  We consider the relativistic Vlasov-Maxwell and Vlasov-Nordstr\""om systems which describe large particle ensembles interacting by either electromagnetic fields or a relativistic scalar gravity model. For both systems we derive a radiation formula analogous to the Einstein quadrupole formula in general relativity. ",https://doi.org/10.1007/s00220-006-0015-3,math-ph/0508057v1,No,
0000-0002-0235-0931,Sebastian Bauer,Kiel University,Wave-like Properties of Phasor Fields: Experimental Demonstrations,2019,"  Recently, an optical meta concept called the Phasor Field (P-Field) was proposed that yields great quality in the reconstruction of hidden objects imaged by non-line-of-sight (NLOS) imaging. It is based on virtual sinusoidal modulation of the light with frequencies in the MHz range. Phasor Field propagation was shown to be described by the Rayleigh-Sommerfeld diffraction integral. We extend this concept and stress the analogy between electric field and Phasor Field. We introduce Phasor Field optical elements and present experiments demonstrating the validity of the approach. Straightforward use of the Phasor Field concept in real-world applications is also discussed. ",Kein DOI-Link verfügbar,1904.01565v1,No,
0000-0002-0235-0931,Sebastian Bauer,Kiel University,Staging Epileptogenesis with Deep Neural Networks,2020,"  Epilepsy is a common neurological disorder characterized by recurrent seizures accompanied by excessive synchronous brain activity. The process of structural and functional brain alterations leading to increased seizure susceptibility and eventually spontaneous seizures is called epileptogenesis (EPG) and can span months or even years. Detecting and monitoring the progression of EPG could allow for targeted early interventions that could slow down disease progression or even halt its development. Here, we propose an approach for staging EPG using deep neural networks and identify potential electroencephalography (EEG) biomarkers to distinguish different phases of EPG. Specifically, continuous intracranial EEG recordings were collected from a rodent model where epilepsy is induced by electrical perforant pathway stimulation (PPS). A deep neural network (DNN) is trained to distinguish EEG signals from before stimulation (baseline), shortly after the PPS and long after the PPS but before the first spontaneous seizure (FSS). Experimental results show that our proposed method can classify EEG signals from the three phases with an average area under the curve (AUC) of 0.93, 0.89, and 0.86. To the best of our knowledge, this represents the first successful attempt to stage EPG prior to the FSS using DNNs. ",Kein DOI-Link verfügbar,2006.09885v1,Yes,potent(1)
0000-0002-0235-0931,Sebastian Bauer,Kiel University,Nanosized superparamagnetic precipitates in cobalt-doped ZnO,2008,"  The existence of semiconductors exhibiting long-range ferromagnetic ordering at room temperature still is controversial. One particularly important issue is the presence of secondary magnetic phases such as clusters, segregations, etc... These are often tedious to detect, leading to contradictory interpretations. We show that in our cobalt doped ZnO films grown homoepitaxially on single crystalline ZnO substrates the magnetism unambiguously stems from metallic cobalt nano-inclusions. The magnetic behavior was investigated by SQUID magnetometry, x-ray magnetic circular dichroism, and AC susceptibility measurements. The results were correlated to a detailed microstructural analysis based on high resolution x-ray diffraction, transmission electron microscopy, and electron-spectroscopic imaging. No evidence for carrier mediated ferromagnetic exchange between diluted cobalt moments was found. In contrast, the combined data provide clear evidence that the observed room temperature ferromagnetic-like behavior originates from nanometer sized superparamagnetic metallic cobalt precipitates. ",https://doi.org/10.1140/epjb/e2008-00252-4,0803.3774v2,No,
0000-0002-0235-0931,Sebastian Bauer,Kiel University,Towards Early Diagnosis of Epilepsy from EEG Data,2020,"  Epilepsy is one of the most common neurological disorders, affecting about 1% of the population at all ages. Detecting the development of epilepsy, i.e., epileptogenesis (EPG), before any seizures occur could allow for early interventions and potentially more effective treatments. Here, we investigate if modern machine learning (ML) techniques can detect EPG from intra-cranial electroencephalography (EEG) recordings prior to the occurrence of any seizures. For this we use a rodent model of epilepsy where EPG is triggered by electrical stimulation of the brain. We propose a ML framework for EPG identification, which combines a deep convolutional neural network (CNN) with a prediction aggregation method to obtain the final classification decision. Specifically, the neural network is trained to distinguish five second segments of EEG recordings taken from either the pre-stimulation period or the post-stimulation period. Due to the gradual development of epilepsy, there is enormous overlap of the EEG patterns before and after the stimulation. Hence, a prediction aggregation process is introduced, which pools predictions over a longer period. By aggregating predictions over one hour, our approach achieves an area under the curve (AUC) of 0.99 on the EPG detection task. This demonstrates the feasibility of EPG prediction from EEG recordings. ",Kein DOI-Link verfügbar,2006.06675v2,Yes,potent(1)
0000-0002-0235-0931,Sebastian Bauer,Kiel University,Real-time Non-line-of-Sight imaging of dynamic scenes,2020,"  Non-Line-of-Sight (NLOS) imaging aims at recovering the 3D geometry of objects that are hidden from the direct line of sight. In the past, this method has suffered from the weak available multibounce signal limiting scene size, capture speed, and reconstruction quality. While algorithms capable of reconstructing scenes at several frames per second have been demonstrated, real-time NLOS video has only been demonstrated for retro-reflective objects where the NLOS signal strength is enhanced by 4 orders of magnitude or more. Furthermore, it has also been noted that the signal-to-noise ratio of reconstructions in NLOS methods drops quickly with distance and past reconstructions, therefore, have been limited to small scenes with depths of few meters. Actual models of noise and resolution in the scene have been simplistic, ignoring many of the complexities of the problem. We show that SPAD (Single-Photon Avalanche Diode) array detectors with a total of just 28 pixels combined with a specifically extended Phasor Field reconstruction algorithm can reconstruct live real-time videos of non-retro-reflective NLOS scenes. We provide an analysis of the Signal-to-Noise-Ratio (SNR) of our reconstructions and show that for our method it is possible to reconstruct the scene such that SNR, motion blur, angular resolution, and depth resolution are all independent of scene size suggesting that reconstruction of very large scenes may be possible. In the future, the light efficiency for NLOS imaging systems can be improved further by adding more pixels to the sensor array. ",https://doi.org/10.1038/s41467-021-26721-x,2010.12737v1,No,
0000-0002-0235-0931,Sebastian Bauer,Kiel University,Zinc Oxide - From Dilute Magnetic Doping to Spin Transport,2013,"  During the past years there has been renewed interest in the wide-bandgap II-VI semiconductor ZnO, triggered by promising prospects for spintronic applications. First, ferromagnetism was predicted for dilute magnetic doping. In comprehensive investigation of ZnO:Co thin films based on the combined measurement of macroscopic and microscopic properties, we find no evidence for carrier-mediated itinerant ferromagnetism. Phase-pure, crystallographically excellent ZnO:Co is uniformly paramagnetic. Superparamagnetism arises when phase separation or defect formation occurs, due to nanometer-sized metallic precipitates. Other compounds like ZnO:(Li,Ni) and ZnO:Cu do not exhibit indication of ferromagnetism.   Second, its small spin-orbit coupling and correspondingly large spin coherence length makes ZnO suitable for transporting or manipulating spins in spintronic devices. From optical pump/optical probe experiments, we find a spin dephasing time of the order of 15 ns at low temperatures which we attribute to electrons bound to Al donors. In all-electrical magnetotransport measurements, we successfully create and detect a spin-polarized ensemble of electrons and transport this spin information across several nanometers. We derive a spin lifetime of 2.6 ns for these itinerant spins at low temperatures, corresponding well to results from an electrical pump/optical probe experiment. ",https://doi.org/10.1002/pssb.201350230,1309.5857v1,No,
0000-0002-0235-0931,Sebastian Bauer,Kiel University,Viewpoint Planning for Quantitative Coronary Angiography,2018,"  In coronary angiography the condition of myocardial blood supply is assessed by analyzing 2-D X-ray projections of contrasted coronary arteries. This is done using a flexible C-arm system. Due to the X-ray immanent dimensionality reduction projecting the 3-D scene onto a 2-D image, the viewpoint is critical to guarantee an appropriate view onto the affected artery and, thus, enable reliable diagnosis. In this work we introduce an algorithm computing optimal viewpoints for the assessment of coronary arteries without the need for 3-D models. We introduce the concept of optimal viewpoint planning solely based on a single angiographic X-ray image. The subsequent viewpoint is computed such that it is rotated precisely around a vessel, while minimizing foreshortening. Our algorithm reduces foreshortening substantially compared to the input view and completely eliminates it for 90 degree rotations. Rotations around iso-centered foreshortening-free vessels passing the isocenter are exact. The precision, however, decreases when the vessel is off-centered or foreshortened. We evaluate worst case boundaries, providing insight in the maximal inaccuracies to be expected. This can be utilized to design viewpoints guaranteeing desired requirements, e.g. a true rotation around the vessel of at minimum 30 degree. ",https://doi.org/10.1007/s11548-018-1763-1,1808.00853v1,No,
0000-0002-8566-0504,Samuel Müller,Kiel University,Smooth tail index estimation,2006,"  Both parametric distribution functions appearing in extreme value theory - the generalized extreme value distribution and the generalized Pareto distribution - have log-concave densities if the extreme value index gamma is in [-1,0]. Replacing the order statistics in tail index estimators by their corresponding quantiles from the distribution function that is based on the estimated log-concave density leads to novel smooth quantile and tail index estimators. These new estimators aim at estimating the tail index especially in small samples. Acting as a smoother of the empirical distribution function, the log-concave distribution function estimator reduces estimation variability to a much greater extent than it introduces bias. As a consequence, Monte Carlo simulations demonstrate that the smoothed version of the estimators are well superior to their non-smoothed counterparts, in terms of mean squared error. ",https://doi.org/10.1080/00949650802142667,math/0612140v2,No,
0000-0002-8566-0504,Samuel Müller,Kiel University,Byte-Pair Encoding for Text-to-SQL Generation,2019,"  Neural sequence-to-sequence models provide a competitive approach to the task of mapping a question in natural language to an SQL query, also referred to as text-to-SQL generation. The Byte-Pair Encoding algorithm (BPE) has previously been used to improve machine translation (MT) between natural languages. In this work, we adapt BPE for text-to-SQL generation. As the datasets for this task are rather small compared to MT, we present a novel stopping criterion that prevents overfitting the BPE encoding to the training set. Additionally, we present AST BPE, which is a version of BPE that uses the Abstract Syntax Tree (AST) of the SQL statement to guide BPE merges and therefore produce BPE encodings that generalize better. We improved the accuracy of a strong attentive seq2seq baseline on five out of six English text-to-SQL tasks while reducing training time by more than 50% on four of them due to the shortened targets. Finally, on two of these tasks we exceeded previously reported accuracies. ",Kein DOI-Link verfügbar,1910.08962v2,No,
0009-0005-7568-7518,Philipp Frey,Kiel University,Realization of a discrete time crystal on 57 qubits of a quantum   computer,2021,"  Novel dynamical phases that violate ergodicity have been a subject of extensive research in recent years. A periodically driven system is naively expected to lose all memory of its initial state due to thermalization, yet this can be avoided in the presence of many-body localization. A discrete time crystal represents a driven system whose local observables spontaneously break time translation symmetry and retain memory of the initial state indefinitely. Here we report the observation of a discrete time crystal on a chain consisting of 57 superconducting qubits on a state--of--the--art quantum computer. We probe random initial states and compare the cases of vanishing and finite disorder to distinguish many-body localization from pre-thermal dynamics. We further report results on the dynamical phase transition between the discrete time crystal and a thermal regime, which is observed via critical fluctuations in the system's sub-harmonic frequency response and a significant speed-up of spin depolarisation. ",Kein DOI-Link verfügbar,2105.06632v3,No,
0009-0005-7568-7518,Philipp Frey,Kiel University,Hilbert space fragmentation and interaction-induced localization in the   extended Fermi-Hubbard model,2022,"  We study Hilbert space fragmentation in the extended Fermi-Hubbard model with nearest and next-nearest-neighbor interactions. Using a generalized spin/mover picture and saddle point methods, we derive lower bounds for the scaling of the number of frozen states and for the size of the largest block preserved under the dynamics. We find fragmentation for strong nearest- and next-nearest-neighbor repulsions as well as for the combined case. Our results suggest that the involvement of next-nearest-neighbor repulsions leads to an increased tendency for localization. We then model the dynamics for larger systems using Markov simulations to test these findings and unveil in which interaction regimes the dynamics becomes spatially localized. In particular, we show that for strong nearest- and next-nearest-neighbor interactions random initial states will localize provided that the density of initial movers is sufficiently low. ",https://doi.org/10.1103/PhysRevB.106.L220301,2209.11777v2,No,
0009-0005-7568-7518,Philipp Frey,Kiel University,Probing Hilbert space fragmentation and the block inverse participation   ratio,2023,"  We consider a family of quantum many-body Hamiltonians that show exact Hilbert space fragmentation in certain limits. The question arises whether fragmentation has implications for Hamiltonians in the vicinity of the subset defined by these exactly fragmented models, in particular in the thermodynamic limit. We attempt to illuminate this issue by considering distinguishable classes of transitional behavior between fragmented and nonfragmented regimes and employing a set of numerical observables that indicate this transition. As one of these observables we present a modified inverse participation ratio (IPR) that is designed to capture the emergence of fragmented block structures. We compare this block IPR to other definitions of inverse participation ratios, as well as to the more traditional measures of level-spacing statistics and entanglement entropy. In order to resolve subtleties that arise in the numerics, we use perturbation theory around the fragmented limit as a basis for defining an effective block structure. We find that our block IPR predicts a boundary between fragmented and nonfragmented regimes that is compatible with results based on level statistics and bipartite entanglement. A scaling analysis indicates that a finite region around the exactly fragmented limit is dominated by effects of approximate fragmentation, even in the thermodynamic limit, and suggests that fragmentation constitutes a phase. We provide evidence for the universality of our approach by applying it to a different family of Hamiltonians, that features a fragmented limit due to emergent dipole conservation. ",https://doi.org/10.1103/PhysRevB.109.064302,2309.03632v2,No,
0000-0003-4650-1110,Mitja Kulczynski,Kiel University,The Show Must Go On -- Examination During a Pandemic,2021,"  When unexpected incidents occur, new innovative and flexible solutions are required. If this event is something such radical and dramatic like the COVID-19 pandemic, these solutions must aim to guarantee as much normality as possible while protecting lives. After a moment of shock our university decided that the students have to be able to pursue their studies for guaranteeing a degree in the expected time since most of them faced immediate financial problems due to the loss of their student jobs. This implied, for us as teachers, that we had to reorganise not only the teaching methods from nearly one day to the next, but we also had to come up with an adjusted way of examinations which had to take place in person with pen and paper under strict hygiene rules. On the other hand the correction should avoid personal contacts. We developed a framework which allowed us to correct the digitalised exams safely at home while providing the high standards given by the general data protection regulation of our country. Moreover, the time spent in the offices could be reduced to a minimum thanks to automatically generated exam sheets, automatically re-digitalised and sorted worked-on exams. ",Kein DOI-Link verfügbar,2107.04014v1,Yes,innovative(1)
