ORCID,Author,Institution,Title,PubDate,Abstract,DOI,IDlist,flag,found_words
0000-0002-2869-226X,Weichen Wang,CAU,Asymptotics of Empirical Eigen-structure for Ultra-high Dimensional   Spiked Covariance Model,2015,"  We derive the asymptotic distributions of the spiked eigenvalues and eigenvectors under a generalized and unified asymptotic regime, which takes into account the spike magnitude of leading eigenvalues, sample size, and dimensionality. This new regime allows high dimensionality and diverging eigenvalue spikes and provides new insights into the roles the leading eigenvalues, sample size, and dimensionality play in principal component analysis. The results are proven by a technical device, which swaps the role of rows and columns and converts the high-dimensional problems into low-dimensional ones. Our results are a natural extension of those in Paul (2007) to more general setting with new insights and solve the rates of convergence problems in Shen et al. (2013). They also reveal the biases of the estimation of leading eigenvalues and eigenvectors by using principal component analysis, and lead to a new covariance estimator for the approximate factor model, called shrinkage principal orthogonal complement thresholding (S-POET), that corrects the biases. Our results are successfully applied to outstanding problems in estimation of risks of large portfolios and false discovery proportions for dependent test statistics and are illustrated by simulation studies. ",Kein DOI-Link verfügbar,1502.04733v2,No,
0000-0002-2869-226X,Weichen Wang,CAU,Large Covariance Estimation through Elliptical Factor Models,2015,"  We proposed a general Principal Orthogonal complEment Thresholding (POET) framework for large-scale covariance matrix estimation based on an approximate factor model. A set of high level sufficient conditions for the procedure to achieve optimal rates of convergence under different matrix norms were brought up to better understand how POET works. Such a framework allows us to recover the results for sub-Gaussian in a more transparent way that only depends on the concentration properties of the sample covariance matrix. As a new theoretical contribution, for the first time, such a framework allows us to exploit conditional sparsity covariance structure for the heavy-tailed data. In particular, for the elliptical data, we proposed a robust estimator based on marginal and multivariate Kendall's tau to satisfy these conditions. In addition, conditional graphical model was also studied under the same framework. The technical tools developed in this paper are of general interest to high dimensional principal component analysis. Thorough numerical results were also provided to back up the developed theory. ",Kein DOI-Link verfügbar,1507.08377v1,No,
0000-0002-2869-226X,Weichen Wang,CAU,Estimation of functionals of sparse covariance matrices,2014,"  High-dimensional statistical tests often ignore correlations to gain simplicity and stability leading to null distributions that depend on functionals of correlation matrices such as their Frobenius norm and other $\ell_r$ norms. Motivated by the computation of critical values of such tests, we investigate the difficulty of estimation the functionals of sparse correlation matrices. Specifically, we show that simple plug-in procedures based on thresholded estimators of correlation matrices are sparsity-adaptive and minimax optimal over a large class of correlation matrices. Akin to previous results on functional estimation, the minimax rates exhibit an elbow phenomenon. Our results are further illustrated in simulated data as well as an empirical study of data arising in financial econometrics. ",https://doi.org/10.1214/15-AOS1357,1408.5087v2,No,
0000-0002-2869-226X,Weichen Wang,CAU,Robust Covariance Estimation for Approximate Factor Models,2016,"  In this paper, we study robust covariance estimation under the approximate factor model with observed factors. We propose a novel framework to first estimate the initial joint covariance matrix of the observed data and the factors, and then use it to recover the covariance matrix of the observed data. We prove that once the initial matrix estimator is good enough to maintain the element-wise optimal rate, the whole procedure will generate an estimated covariance with desired properties. For data with only bounded fourth moments, we propose to use Huber loss minimization to give the initial joint covariance estimation. This approach is applicable to a much wider range of distributions, including sub-Gaussian and elliptical distributions. We also present an asymptotic result for Huber's M-estimator with a diverging parameter. The conclusions are demonstrated by extensive simulations and real data analysis. ",Kein DOI-Link verfügbar,1602.00719v1,No,
0000-0002-2869-226X,Weichen Wang,CAU,An $\ell_{\infty}$ Eigenvector Perturbation Bound and Its Application to   Robust Covariance Estimation,2016,"  In statistics and machine learning, people are often interested in the eigenvectors (or singular vectors) of certain matrices (e.g. covariance matrices, data matrices, etc). However, those matrices are usually perturbed by noises or statistical errors, either from random sampling or structural patterns. One usually employs Davis-Kahan $\sin \theta$ theorem to bound the difference between the eigenvectors of a matrix $A$ and those of a perturbed matrix $\widetilde{A} = A + E$, in terms of $\ell_2$ norm. In this paper, we prove that when $A$ is a low-rank and incoherent matrix, the $\ell_{\infty}$ norm perturbation bound of singular vectors (or eigenvectors in the symmetric case) is smaller by a factor of $\sqrt{d_1}$ or $\sqrt{d_2}$ for left and right vectors, where $d_1$ and $d_2$ are the matrix dimensions. The power of this new perturbation result is shown in robust covariance estimation, particularly when random variables have heavy tails. There, we propose new robust covariance estimators and establish their asymptotic properties using the newly developed perturbation bound. Our theoretical results are verified through extensive numerical experiments. ",Kein DOI-Link verfügbar,1603.03516v2,No,
0000-0002-2869-226X,Weichen Wang,CAU,Projected principal component analysis in factor models,2014,"  This paper introduces a Projected Principal Component Analysis (Projected-PCA), which employs principal component analysis to the projected (smoothed) data matrix onto a given linear space spanned by covariates. When it applies to high-dimensional factor analysis, the projection removes noise components. We show that the unobserved latent factors can be more accurately estimated than the conventional PCA if the projection is genuine, or more precisely, when the factor loading matrices are related to the projected linear space. When the dimensionality is large, the factors can be estimated accurately even when the sample size is finite. We propose a flexible semiparametric factor model, which decomposes the factor loading matrix into the component that can be explained by subject-specific covariates and the orthogonal residual component. The covariates' effects on the factor loadings are further modeled by the additive model via sieve approximations. By using the newly proposed Projected-PCA, the rates of convergence of the smooth factor loading matrices are obtained, which are much faster than those of the conventional factor analysis. The convergence is achieved even when the sample size is finite and is particularly appealing in the high-dimension-low-sample-size situation. This leads us to developing nonparametric tests on whether observed covariates have explaining powers on the loadings and whether they fully explain the loadings. The proposed method is illustrated by both simulated data and the returns of the components of the S&P 500 index. ",https://doi.org/10.1214/15-AOS1364,1406.3836v3,No,
0000-0002-2869-226X,Weichen Wang,CAU,A Shrinkage Principle for Heavy-Tailed Data: High-Dimensional Robust   Low-Rank Matrix Recovery,2016,"  This paper introduces a simple principle for robust high-dimensional statistical inference via an appropriate shrinkage on the data. This widens the scope of high-dimensional techniques, reducing the moment conditions from sub-exponential or sub-Gaussian distributions to merely bounded second or fourth moment. As an illustration of this principle, we focus on robust estimation of the low-rank matrix $\Theta^*$ from the trace regression model $Y=Tr (\Theta^{*T}X) +\epsilon$. It encompasses four popular problems: sparse linear models, compressed sensing, matrix completion and multi-task regression. We propose to apply penalized least-squares approach to appropriately truncated or shrunk data. Under only bounded $2+\delta$ moment condition on the response, the proposed robust methodology yields an estimator that possesses the same statistical error rates as previous literature with sub-Gaussian errors. For sparse linear models and multi-tasking regression, we further allow the design to have only bounded fourth moment and obtain the same statistical rates, again, by appropriate shrinkage of the design matrix. As a byproduct, we give a robust covariance matrix estimator and establish its concentration inequality in terms of the spectral norm when the random samples have only bounded fourth moment. Extensive simulations have been carried out to support our theories. ",Kein DOI-Link verfügbar,1603.08315v2,No,
0000-0002-2869-226X,Weichen Wang,CAU,Volatility prediction comparison via robust volatility proxies: An   empirical deviation perspective,2021,"  Volatility forecasting is crucial to risk management and portfolio construction. One particular challenge of assessing volatility forecasts is how to construct a robust proxy for the unknown true volatility. In this work, we show that the empirical loss comparison between two volatility predictors hinges on the deviation of the volatility proxy from the true volatility. We then establish non-asymptotic deviation bounds for three robust volatility proxies, two of which are based on clipped data, and the third of which is based on exponentially weighted Huber loss minimization. In particular, in order for the Huber approach to adapt to non-stationary financial returns, we propose to solve a tuning-free weighted Huber loss minimization problem to jointly estimate the volatility and the optimal robustification parameter at each time point. We then inflate this robustification parameter and use it to update the volatility proxy to achieve optimal balance between the bias and variance of the global empirical loss. We also extend this Huber method to construct volatility predictors. Finally, we exploit the proposed robust volatility proxy to compare different volatility predictors on the Bitcoin market data. It turns out that when the sample size is limited, applying the robust volatility proxy gives more consistent and stable evaluation of volatility forecasts. ",Kein DOI-Link verfügbar,2110.01189v1,No,
0000-0002-2869-226X,Weichen Wang,CAU,"The $\mathbf{uvu}$-avoiding $(a,b,c)$-Generalized Motzkin paths with   vertical steps: bijections and statistic enumerations",2022,"  A generalized Motzkin path, called G-Motzkin path for short, of length $n$ is a lattice path from $(0, 0)$ to $(n, 0)$ in the first quadrant of the XOY-plane that consists of up steps $\mathbf{u}=(1, 1)$, down steps $\mathbf{d}=(1, -1)$, horizontal steps $\mathbf{h}=(1, 0)$ and vertical steps $\mathbf{v}=(0, -1)$. An $(a,b,c)$-G-Motzkin path is a weighted G-Motzkin path such that the $\mathbf{u}$-steps, $\mathbf{h}$-steps, $\mathbf{v}$-steps and $\mathbf{d}$-steps are weighted respectively by $1, a, b$ and $c$. In this paper, we first give bijections between the set of $\mathbf{uvu}$-avoiding $(a,b,b^2)$-G-Motzkin paths of length $n$ and the set of $(a,b)$-Schr\""{o}der paths as well as the set of $(a+b,b)$-Dyck paths of length $2n$, between the set of $\{\mathbf{uvu, uu}\}$-avoiding $(a,b,b^2)$-G-Motzkin paths of length $n$ and the set of $(a+b,ab)$-Motzkin paths of length $n$, between the set of $\{\mathbf{uvu,uu}\}$-avoiding $(a,b,b^2)$-G-Motzkin paths of length $n+1$ beginning with an $\mathbf{h}$-step weighted by $a$ and the set of $(a,b)$-Dyck paths of length $2n+2$. In the last section, we focus on the enumeration of statistics ""number of $\mathbf{z}$-steps"" for $\mathbf{z}\in \{\mathbf{u}, \mathbf{h}, \mathbf{v}, \mathbf{d}\}$ and ""number of points"" at given level in $\mathbf{uvu}$-avoiding G-Motzkin paths. These counting results are linked with Riordan arrays. ",Kein DOI-Link verfügbar,2201.09236v1,No,
0000-0002-2869-226X,Weichen Wang,CAU,Ranking Inferences Based on the Top Choice of Multiway Comparisons,2022,"  This paper considers ranking inference of $n$ items based on the observed data on the top choice among $M$ randomly selected items at each trial. This is a useful modification of the Plackett-Luce model for $M$-way ranking with only the top choice observed and is an extension of the celebrated Bradley-Terry-Luce model that corresponds to $M=2$. Under a uniform sampling scheme in which any $M$ distinguished items are selected for comparisons with probability $p$ and the selected $M$ items are compared $L$ times with multinomial outcomes, we establish the statistical rates of convergence for underlying $n$ preference scores using both $\ell_2$-norm and $\ell_\infty$-norm, with the minimum sampling complexity. In addition, we establish the asymptotic normality of the maximum likelihood estimator that allows us to construct confidence intervals for the underlying scores. Furthermore, we propose a novel inference framework for ranking items through a sophisticated maximum pairwise difference statistic whose distribution is estimated via a valid Gaussian multiplier bootstrap. The estimated distribution is then used to construct simultaneous confidence intervals for the differences in the preference scores and the ranks of individual items. They also enable us to address various inference questions on the ranks of these items. Extensive simulation studies lend further support to our theoretical results. A real data application illustrates the usefulness of the proposed methods convincingly. ",Kein DOI-Link verfügbar,2211.11957v3,No,
0000-0002-2869-226X,Weichen Wang,CAU,Inference on Time Series Nonparametric Conditional Moment Restrictions   Using General Sieves,2022,"  General nonlinear sieve learnings are classes of nonlinear sieves that can approximate nonlinear functions of high dimensional variables much more flexibly than various linear sieves (or series). This paper considers general nonlinear sieve quasi-likelihood ratio (GN-QLR) based inference on expectation functionals of time series data, where the functionals of interest are based on some nonparametric function that satisfy conditional moment restrictions and are learned using multilayer neural networks. While the asymptotic normality of the estimated functionals depends on some unknown Riesz representer of the functional space, we show that the optimally weighted GN-QLR statistic is asymptotically Chi-square distributed, regardless whether the expectation functional is regular (root-$n$ estimable) or not. This holds when the data are weakly dependent beta-mixing condition. We apply our method to the off-policy evaluation in reinforcement learning, by formulating the Bellman equation into the conditional moment restriction framework, so that we can make inference about the state-specific value functional using the proposed GN-QLR method with time series data. In addition, estimating the averaged partial means and averaged partial derivatives of nonparametric instrumental variables and quantile IV models are also presented as leading examples. Finally, a Monte Carlo study shows the finite sample performance of the procedure ",Kein DOI-Link verfügbar,2301.00092v2,No,
0000-0002-2869-226X,Weichen Wang,CAU,Spectral Ranking Inferences based on General Multiway Comparisons,2023,"  This paper studies the performance of the spectral method in the estimation and uncertainty quantification of the unobserved preference scores of compared entities in a general and more realistic setup. Specifically, the comparison graph consists of hyper-edges of possible heterogeneous sizes, and the number of comparisons can be as low as one for a given hyper-edge. Such a setting is pervasive in real applications, circumventing the need to specify the graph randomness and the restrictive homogeneous sampling assumption imposed in the commonly used Bradley-Terry-Luce (BTL) or Plackett-Luce (PL) models. Furthermore, in scenarios where the BTL or PL models are appropriate, we unravel the relationship between the spectral estimator and the Maximum Likelihood Estimator (MLE). We discover that a two-step spectral method, where we apply the optimal weighting estimated from the equal weighting vanilla spectral method, can achieve the same asymptotic efficiency as the MLE. Given the asymptotic distributions of the estimated preference scores, we also introduce a comprehensive framework to carry out both one-sample and two-sample ranking inferences, applicable to both fixed and random graph settings. It is noteworthy that this is the first time effective two-sample rank testing methods have been proposed. Finally, we substantiate our findings via comprehensive numerical simulations and subsequently apply our developed methodologies to perform statistical inferences for statistical journals and movie rankings. ",Kein DOI-Link verfügbar,2308.02918v3,Yes,noteworthy(1)
0000-0002-2869-226X,Weichen Wang,CAU,Estimation of Out-of-Sample Sharpe Ratio for High Dimensional Portfolio   Optimization,2024,"  Portfolio optimization aims at constructing a realistic portfolio with significant out-of-sample performance, which is typically measured by the out-of-sample Sharpe ratio. However, due to in-sample optimism, it is inappropriate to use the in-sample estimated covariance to evaluate the out-of-sample Sharpe, especially in the high dimensional settings. In this paper, we propose a novel method to estimate the out-of-sample Sharpe ratio using only in-sample data, based on random matrix theory. Furthermore, portfolio managers can use the estimated out-of-sample Sharpe as a criterion to decide the best tuning for constructing their portfolios. Specifically, we consider the classical framework of Markowits mean-variance portfolio optimization with known mean vector and the high dimensional regime of $p/n \to c \in (0,\infty)$, where $p$ is the portfolio dimension and $n$ is the number of samples or time points. We propose to correct the sample covariance by a regularization matrix and provide a consistent estimator of its Sharpe ratio. The new estimator works well under either of three conditions: (1) bounded covariance spectrum, (2) arbitrary number of diverging spikes when $c < 1$, and (3) fixed number of diverging spikes when $c \ge 1$. We can also extend the results to construct global minimum variance portfolio and correct out-of-sample efficient frontier. We demonstrate the effectiveness of our approach through comprehensive simulations and real data experiments. Our results highlight the potential of this methodology as a powerful tool for portfolio optimization in high dimensional settings. ",Kein DOI-Link verfügbar,2406.03954v1,Yes,potent(1)
0000-0002-2869-226X,Weichen Wang,CAU,Global Convergence of Policy Gradient for Linear-Quadratic Mean-Field   Control/Game in Continuous Time,2020,"  Reinforcement learning is a powerful tool to learn the optimal policy of possibly multiple agents by interacting with the environment. As the number of agents grow to be very large, the system can be approximated by a mean-field problem. Therefore, it has motivated new research directions for mean-field control (MFC) and mean-field game (MFG). In this paper, we study the policy gradient method for the linear-quadratic mean-field control and game, where we assume each agent has identical linear state transitions and quadratic cost functions. While most of the recent works on policy gradient for MFC and MFG are based on discrete-time models, we focus on the continuous-time models where some analyzing techniques can be interesting to the readers. For both MFC and MFG, we provide policy gradient update and show that it converges to the optimal solution at a linear rate, which is verified by a synthetic simulation. For MFG, we also provide sufficient conditions for the existence and uniqueness of the Nash equilibrium. ",Kein DOI-Link verfügbar,2008.06845v1,No,
0000-0002-2869-226X,Weichen Wang,CAU,Heterogeneity Adjustment with Applications to Graphical Model Inference,2016,"  Heterogeneity is an unwanted variation when analyzing aggregated datasets from multiple sources. Though different methods have been proposed for heterogeneity adjustment, no systematic theory exists to justify these methods. In this work, we propose a generic framework named ALPHA (short for Adaptive Low-rank Principal Heterogeneity Adjustment) to model, estimate, and adjust heterogeneity from the original data. Once the heterogeneity is adjusted, we are able to remove the biases of batch effects and to enhance the inferential power by aggregating the homogeneous residuals from multiple sources. Under a pervasive assumption that the latent heterogeneity factors simultaneously affect a large fraction of observed variables, we provide a rigorous theory to justify the proposed framework. Our framework also allows the incorporation of informative covariates and appeals to the ""Bless of Dimensionality"". As an illustrative application of this generic framework, we consider a problem of estimating high-dimensional precision matrix for graphical model inference based on multiple datasets. We also provide thorough numerical studies on both synthetic datasets and a brain imaging dataset to demonstrate the efficacy of the developed theory and methods. ",Kein DOI-Link verfügbar,1602.05455v1,No,
0000-0002-2869-226X,Weichen Wang,CAU,Some statistics on generalized Motzkin paths with vertical steps,2022,"  Recently, several authors have considered lattice paths with various steps, including vertical steps permitted. In this paper, we consider a kind of generalized Motzkin paths, called {\it G-Motzkin paths} for short, that is lattice paths from $(0, 0)$ to $(n, 0)$ in the first quadrant of the $XOY$-plane that consist of up steps $\mathbf{u}=(1, 1)$, down steps $\mathbf{d}=(1, -1)$, horizontal steps $\mathbf{h}=(1, 0)$ and vertical steps $\mathbf{v}=(0, -1)$. We mainly count the number of G-Motzkin paths of length $n$ with given number of $\mathbf{z}$-steps for $\mathbf{z}\in \{\mathbf{u}, \mathbf{h}, \mathbf{v}, \mathbf{d}\}$, and enumerate the statistics ""number of $\mathbf{z}$-steps"" at given level in G-Motzkin paths for $\mathbf{z}\in \{\mathbf{u}, \mathbf{h}, \mathbf{v}, \mathbf{d}\}$, some explicit formulas and combinatorial identities are given by bijective and algebraic methods, some enumerative results are linked with Riordan arrays according to the structure decompositions of G-Motzkin paths. We also discuss the statistics ""number of $\mathbf{z}_1\mathbf{z}_2$-steps"" in G-Motzkin paths for $\mathbf{z}_1, \mathbf{z}_2\in \{\mathbf{u}, \mathbf{h}, \mathbf{v}, \mathbf{d}\}$, the exact counting formulas except for $\mathbf{z}_1\mathbf{z}_2=\mathbf{dd}$ are obtained by the Lagrange inversion formula and their generating functions. ",Kein DOI-Link verfügbar,2201.09231v1,No,
0000-0002-2869-226X,Weichen Wang,CAU,Using Mobile Data and Deep Models to Assess Auditory Verbal   Hallucinations,2023,"  Hallucination is an apparent perception in the absence of real external sensory stimuli. An auditory hallucination is a perception of hearing sounds that are not real. A common form of auditory hallucination is hearing voices in the absence of any speakers which is known as Auditory Verbal Hallucination (AVH). AVH is fragments of the mind's creation that mostly occur in people diagnosed with mental illnesses such as bipolar disorder and schizophrenia. Assessing the valence of hallucinated voices (i.e., how negative or positive voices are) can help measure the severity of a mental illness. We study N=435 individuals, who experience hearing voices, to assess auditory verbal hallucination. Participants report the valence of voices they hear four times a day for a month through ecological momentary assessments with questions that have four answering scales from ``not at all'' to ``extremely''. We collect these self-reports as the valence supervision of AVH events via a mobile application. Using the application, participants also record audio diaries to describe the content of hallucinated voices verbally. In addition, we passively collect mobile sensing data as contextual signals. We then experiment with how predictive these linguistic and contextual cues from the audio diary and mobile sensing data are of an auditory verbal hallucination event. Finally, using transfer learning and data fusion techniques, we train a neural net model that predicts the valance of AVH with a performance of 54\% top-1 and 72\% top-2 F1 score. ",Kein DOI-Link verfügbar,2304.11049v1,No,
